<?xml version="1.0" encoding="UTF-8"?>
<!DOCTYPE ST26SequenceListing PUBLIC "-//WIPO//DTD Sequence Listing 1.0//EN" "ST26SequenceListing_V1_0.dtd">
<?xml-stylesheet type="text/xsl" href="st26.xsl"?>
<ST26SequenceListing dtdVersion="1.0" 
                    fileName="file2"
                    softwareName="ST26 authoring tool prototype" 
                    softwareVersion="0.1"
                    productionDate="Feb. 2, 2016">
<!-- <ST26SequenceListing dtdVersion="1.0" 
                    fileName="file2"
                    softwareName="ST26 authoring tool prototype" 
                    softwareVersion="0.1"
                    productionDate="Feb. 2, 2016, 10:47 p.m."
                    xmlns:xsi="http://www.w3.org/2001/XMLSchema-instance"
                    xsi:noNamespaceSchemaLocation="st26.xsd"> -->
    <ApplicationIdentification>
        <IPOfficeCode>EP</IPOfficeCode>
        <ApplicationNumberText>1299887766.5</ApplicationNumberText>
        <FilingDate>Aug. 3, 2014</FilingDate>
    </ApplicationIdentification>
    <ApplicantFileReference>WO123</ApplicantFileReference>
    <EarliestPriorityApplicationIdentification>
        <IPOfficeCode>JP</IPOfficeCode>
        <ApplicationNumberText>54545454</ApplicationNumberText>
        <FilingDate>Dec. 29, 2013</FilingDate>
    </EarliestPriorityApplicationIdentification>
    <ApplicantName languageCode="EN">
        applicant2
    </ApplicantName>
    <ApplicantNameLatin>
        applicant2
    </ApplicantNameLatin>
    <InventorName languageCode="EN">
        inventor2
    </InventorName>
    <InventorNameLatin>
        inventor2
    </InventorNameLatin>
    
        <InventionTitle languageCode="EN">
            title3
        </InventionTitle>
    
        <InventionTitle languageCode="JP">
            title4
        </InventionTitle>
    
    
    <SequenceTotalQuantity>
        2
    </SequenceTotalQuantity>
    
        <SequenceData sequenceIDNumber="1">
            <INSDSeq>
                <INSDSeq_length>30</INSDSeq_length>
                <INSDSeq_moltype>DNA</INSDSeq_moltype>
                <INSDSeq_division>PAT</INSDSeq_division>
                <INSDSeq_other-seqids>
                    <INSDSeqid>-</INSDSeqid>
                </INSDSeq_other-seqids>
                <INSDSeq_feature-table>
                    
                        <INSDFeature>
                            <INSDFeature_key>source</INSDFeature_key>
                            <INSDFeature_location>1..30</INSDFeature_location>
                            <INSDFeature_quals>
                                
                                <INSDQualifier>
                                    <INSDQualifier_name>organism</INSDQualifier_name>
                                    <INSDQualifier_value>homo sapiens</INSDQualifier_value>
                                </INSDQualifier>
                                
                                <INSDQualifier>
                                    <INSDQualifier_name>mol_type</INSDQualifier_name>
                                    <INSDQualifier_value>genomic DNA</INSDQualifier_value>
                                </INSDQualifier>
                                
                            </INSDFeature_quals>
                        </INSDFeature>
                    
                        <INSDFeature>
                            <INSDFeature_key>allele</INSDFeature_key>
                            <INSDFeature_location>4..6</INSDFeature_location>
                            <INSDFeature_quals>
                                
                            </INSDFeature_quals>
                        </INSDFeature>
                    
                </INSDSeq_feature-table>
                <INSDSeq_sequence>agtcncttagggacccaacactttcattca</INSDSeq_sequence>
            </INSDSeq>
        </SequenceData>
    
        <SequenceData sequenceIDNumber="2">
            <INSDSeq>
                <INSDSeq_length>5</INSDSeq_length>
                <INSDSeq_moltype>AA</INSDSeq_moltype>
                <INSDSeq_division>PAT</INSDSeq_division>
                <INSDSeq_other-seqids>
                    <INSDSeqid>-</INSDSeqid>
                </INSDSeq_other-seqids>
                <INSDSeq_feature-table>
                    
                        <INSDFeature>
                            <INSDFeature_key>SOURCE</INSDFeature_key>
                            <INSDFeature_location>1..5</INSDFeature_location>
                            <INSDFeature_quals>
                                
                                <INSDQualifier>
                                    <INSDQualifier_name>ORGANISM</INSDQualifier_name>
                                    <INSDQualifier_value>mus</INSDQualifier_value>
                                </INSDQualifier>
                                
                                <INSDQualifier>
                                    <INSDQualifier_name>MOL_TYPE</INSDQualifier_name>
                                    <INSDQualifier_value>protein</INSDQualifier_value>
                                </INSDQualifier>
                                
                            </INSDFeature_quals>
                        </INSDFeature>
                    
                        <INSDFeature>
                            <INSDFeature_key>VARIATION</INSDFeature_key>
                            <INSDFeature_location>3</INSDFeature_location>
                            <INSDFeature_quals>
                                
                            </INSDFeature_quals>
                        </INSDFeature>
                    
                </INSDSeq_feature-table>
                <INSDSeq_sequence>MTERT</INSDSeq_sequence>
            </INSDSeq>
        </SequenceData>
      
</ST26SequenceListing>
