<?xml version="1.0" encoding="UTF-8"?>
<!DOCTYPE ST26SequenceListing PUBLIC "-//WIPO//DTD Sequence Listing 1.0//EN" "ST26SequenceListing_V1_0.dtd">
<?xml-stylesheet type="text/xsl" href="st26.xsl"?>
<ST26SequenceListing dtdVersion="1" 
                    fileName="Berthold1"
                    softwareName="prototype" 
                    softwareVersion="0.1"
                    productionDate="Feb. 3, 2016">
<!-- <ST26SequenceListing dtdVersion="1" 
                    fileName="Berthold1"
                    softwareName="prototype" 
                    softwareVersion="0.1"
                    productionDate="Feb. 3, 2016, 11:32 p.m."
                    xmlns:xsi="http://www.w3.org/2001/XMLSchema-instance"
                    xsi:noNamespaceSchemaLocation="st26.xsd"> -->
    <ApplicationIdentification>
        <IPOfficeCode>EP</IPOfficeCode>
        <ApplicationNumberText>sdf</ApplicationNumberText>
        <FilingDate>Jan. 1, 2015</FilingDate>
    </ApplicationIdentification>
    <ApplicantFileReference>xxx</ApplicantFileReference>
    <EarliestPriorityApplicationIdentification>
        <IPOfficeCode>EP</IPOfficeCode>
        <ApplicationNumberText>ep552668</ApplicationNumberText>
        <FilingDate>Jan. 1, 2014</FilingDate>
    </EarliestPriorityApplicationIdentification>
    <ApplicantName languageCode="sd">
        sdf
    </ApplicantName>
    <ApplicantNameLatin>
        sdfd
    </ApplicantNameLatin>
    <InventorName languageCode="sd">
        sdfsd
    </InventorName>
    <InventorNameLatin>
        sdf
    </InventorNameLatin>
    
        <InventionTitle languageCode="EN">
            Test_Berthold
        </InventionTitle>
    
    
    <SequenceTotalQuantity>
        1
    </SequenceTotalQuantity>
    
        <SequenceData sequenceIDNumber="1">
            <INSDSeq>
                <INSDSeq_length>11</INSDSeq_length>
                <INSDSeq_moltype>AA</INSDSeq_moltype>
                <INSDSeq_division>PAT</INSDSeq_division>
                <INSDSeq_other-seqids>
                    <INSDSeqid>-</INSDSeqid>
                </INSDSeq_other-seqids>
                <INSDSeq_feature-table>
                    
                        <INSDFeature>
                            <INSDFeature_key>SOURCE</INSDFeature_key>
                            <INSDFeature_location>1..11</INSDFeature_location>
                            <INSDFeature_quals>
                                
                                <INSDQualifier>
                                    <INSDQualifier_name>ORGANISM</INSDQualifier_name>
                                    <INSDQualifier_value>Homo sapiens</INSDQualifier_value>
                                </INSDQualifier>
                                
                                <INSDQualifier>
                                    <INSDQualifier_name>MOL_TYPE</INSDQualifier_name>
                                    <INSDQualifier_value>protein</INSDQualifier_value>
                                </INSDQualifier>
                                
                            </INSDFeature_quals>
                        </INSDFeature>
                    
                </INSDSeq_feature-table>
                <INSDSeq_sequence>gratarecase</INSDSeq_sequence>
            </INSDSeq>
        </SequenceData>
      
</ST26SequenceListing>
